recipe_id,recipe_name,cuisine,diet,minutes,rating,review_count,final_score,semantic_similarity,ingredient_overlap,popularity_score,cost_efficiency_score,prep_efficiency_score,margin_score,matched_ingredients,explanation
1,Herbed Flatbread with Tomato and Mozzarella,Italian,Vegetarian,22,4.7,128,0.5190787124762813,0.20512820512820512,0.5454545454545454,0.7597061240232499,0.8125,0.8,0.7142857142857149,"['basil', 'flatbread', 'mozzarella', 'olive oil', 'tomato', 'tomato sauce']","Recommended because it uses trend-relevant ingredients: basil, flatbread, mozzarella, olive oil, tomato; has strong popularity signals; is operationally quick to prepare; looks cost efficient; has attractive margin potential."
5,Mediterranean Chickpea Bowl,Mediterranean,Vegetarian,15,4.6,156,0.3913118851609723,0.02127659574468085,0.18181818181818182,0.6995225889243044,0.90625,1.0,0.857142857142857,"['tomato', 'tomato sauce']","Recommended because it uses trend-relevant ingredients: tomato, tomato sauce; has strong popularity signals; is operationally quick to prepare; looks cost efficient; has attractive margin potential."
2,Spicy Kimchi Quesadilla,Korean Fusion,,18,4.5,89,0.31725659334272477,0.021739130434782608,0.0,0.45479550841319616,1.0,0.9142857142857143,1.0,[],Recommended because it is operationally quick to prepare; looks cost efficient; has attractive margin potential.
6,Garlic Mushroom Toast,European,Vegetarian,20,4.4,74,0.2967123302239104,0.022222222222222223,0.18181818181818182,0.30177147518200925,0.875,0.8571428571428572,0.5000000000000004,"['dough', 'mushroom']","Recommended because it uses trend-relevant ingredients: dough, mushroom; is operationally quick to prepare; looks cost efficient."
4,Buffalo Chicken Dip,American,,30,4.8,220,0.24508752117447768,0.043478260869565216,0.09090909090909091,1.0,0.0,0.5714285714285714,0.0,['cheese'],Recommended because it uses trend-relevant ingredients: cheese; has strong popularity signals.
